{"$id":"urn:hivehub:schema:adapter-registration:1","$schema":"https://json-schema.org/draft/2020-12/schema","additionalProperties":false,"properties":{"adapter_version":{"maxLength":4096,"minLength":1,"type":"string"},"conformance_address":{"pattern":"^urn:hivehub:sha256:[0-9a-f]{64}$","type":"string"},"effect_kinds":{"items":{"enum":["authenticate","clone","execute","fetch","other","write"]},"maxItems":256,"type":"array"},"interface_version":{"maxLength":4096,"minLength":1,"type":"string"},"kind":{"const":"adapter-registration"},"locator":{"maxLength":4096,"minLength":1,"type":"string"},"name":{"maxLength":4096,"minLength":1,"type":"string"},"operations":{"items":{"maxLength":4096,"minLength":1,"type":"string"},"maxItems":256,"minItems":1,"type":"array"},"protocol_fingerprint":{"pattern":"^urn:hivehub:sha256:[0-9a-f]{64}$","type":"string"},"schema_version":{"const":1}},"required":["kind","schema_version","protocol_fingerprint","name","adapter_version","interface_version","locator","conformance_address","operations","effect_kinds"],"title":"adapter-registration","type":"object"}
