{"adapter_version":"3.0","conformance_address":"urn:hivehub:sha256:4aa9adef487b97709593fd0f78d379914eecbabd3afd272cca587e674ad4f90c","effect_kinds":["fetch"],"interface_version":"hive-hub-adapter/1","kind":"adapter-registration","locator":"urn:firefly:adapter:local-v3","name":"Firefly local adapter","operations":["authorize","fetch","subscribe"],"protocol_fingerprint":"urn:hivehub:sha256:92299f6ce3a2c80ea3f80810c74dc208748b413167dbbbefeae6ece427a05367","schema_version":1}
