{"adapter_version":"0","conformance_address":"urn:hivehub:sha256:1e0848b944c24b82dc42638983931ddc3d5b09241ea8e93f7ebb7e8428d5ab1c","effect_kinds":["other"],"interface_version":"hive-hub-adapter/1","kind":"adapter-registration","locator":"urn:hivehub:adapter:hive-md-dial-pins:sha256:fb52cd3ebcb07a85b19298a12ca6f26fd448505d231c7951382a9606acfb9824","name":"hive-md-dial-pins","operations":["handoff","validate"],"protocol_fingerprint":"urn:hivehub:sha256:6f6cb57893764dad9311813ed5d08d1a8788c1c0334e0382cd41901d7b0bafc5","schema_version":1}
